{
	"$schema": "../../post.schema.json",
	"slug": "image-correction-microscopy",
	"title": "Image Correction Microscopy",
	"description": "Fluorescence microscopy images are plagued with background noise. The standard approach to correcting for this is insufficient.\n",
	"editedAt": "2021-11-28T00:00:00.000Z",
	"publishedAt": "2014-05-31T00:00:00.000Z",
	"legacySlug": "image-correction-in-fluorescence-microscopy",
	"tags": ["science", "biology", "phd"]
}
