{
	"$schema": "../post.schema.json",
	"slug": "birthday-problem-python",
	"title": "The \"Birthday Problem\" simulated with Python",
	"description": "There's better than a 50% chance that 2 of any 25 random people will share the same birthday. That's hard to believe. Let's simulate it!\n",
	"publishedAt": "2011-07-13T00:00:00.000Z",
	"legacySlug": "python-shared-birthdays",
	"tags": ["math", "learn", "statistics", "simulation", "programming", "python"]
}
