{
	"$schema": "../../post.schema.json",
	"slug": "geb-wondrousness-python",
	"title": "\"GÃ¶del, Escher, Bach\": Wondrousness in Python",
	"description": "In GEB the Tortoise and Achilles describe a number property they call \"Wondrousness\". It creates a fascinating graph.\n",
	"publishedAt": "2011-01-15T00:00:00.000Z",
	"legacySlug": "python-geb-and-wondrousness",
	"tags": ["math", "learn", "simulation", "programming", "python"]
}
